{
    "schemaVersion": 1,
    "id": "credential-import",
    "type": "feature",
    "riskTier": "normal",
    "scope": {
        "summary": "Import ZaloDataExtractor JSON credentials: add types/ DTOs (Credentials, AccountProfile, CredentialSummary) and a command/ import_credentials handler that validates the JSON and returns a non-secret summary to the UI.",
        "goals": [
            "types/ exposes pure Credentials + AccountProfile DTOs with no zca-rust dependency",
            "command/ import_credentials parses + validates the export and returns CredentialSummary (no token values)",
            "Invalid JSON / missing fields are rejected with a clear, value-free error; valid payloads parse"
        ],
        "nonGoals": [
            "Persisting credentials anywhere (Phase 3 keychain — secure-cred-store)",
            "Performing a real login (single-login feature)",
            "Returning imei/cookie/userAgent values across the IPC boundary"
        ]
    },
    "acceptance": [
        {
            "id": "type",
            "description": "types/ provides Credentials + AccountProfile DTOs that deserialize the ZaloDataExtractor shape and validate required fields.",
            "verification": {
                "command": "cargo test --manifest-path src-tauri/Cargo.toml"
            }
        },
        {
            "id": "cmd",
            "description": "command/ import_credentials parses JSON, validates, and returns a non-secret CredentialSummary.",
            "verification": {
                "command": "cargo test --manifest-path src-tauri/Cargo.toml"
            }
        },
        {
            "id": "smoke",
            "description": "Malformed JSON, empty cookies, and blank imei are rejected with clear errors; a valid payload imports and language defaults to vi.",
            "verification": {
                "command": "cargo test --manifest-path src-tauri/Cargo.toml"
            }
        }
    ],
    "requiresAdr": false,
    "requiredReviewers": [
        "advisor",
        "architecture-reviewer"
    ],
    "permissions": {
        "allow": [
            "Read",
            "Grep",
            "Glob",
            "Write",
            "Edit",
            "Bash(cargo:*)",
            "Bash(node:*)",
            "Bash(npm:*)",
            "Bash(git:*)"
        ]
    },
    "doneRequires": [
        "structural",
        "lint",
        "tests",
        "review",
        "evidence-bundle"
    ],
    "evidencePath": ".harness/evidence/credential-import.json"
}